<?xml version="1.0" encoding="UTF-8"?><!DOCTYPE testcase SYSTEM "dtd/testcase.dtd">
<testcase>
	<step command="Open_Url"><![CDATA[onkey.html]]></step>
	<step command="Assert_Title"><![CDATA[Wetator / OnKey]]></step>
	<step command="Comment"><![CDATA[simple submit]]></step>
	<step command="Click_On"><![CDATA[OK]]></step>
	<step command="Assert_Content"><![CDATA[Key Value eventTrace OnKeyTest OK]]></step>
	<step command="Comment"></step>
	<step command="Comment"></step>
	<step command="Open_Url"><![CDATA[onkey.html]]></step>
	<step command="Assert_Title"><![CDATA[Wetator / OnKey]]></step>
	<step command="Comment"><![CDATA[set input text]]></step>
	<step command="Set"><![CDATA[InputText]]><optionalParameter><![CDATA[i]]></optionalParameter></step>
	<step command="Click_On"><![CDATA[OK]]></step>
	<step command="Assert_Content"><![CDATA[Key Value eventTrace onKeyDown(inputText); onKeyPress(inputText); onKeyUp(inputText); OnKeyTest OK]]></step>
	<step command="Comment"></step>
	<step command="Comment"></step>
	<step command="Open_Url"><![CDATA[onkey.html]]></step>
	<step command="Assert_Title"><![CDATA[Wetator / OnKey]]></step>
	<step command="Comment"><![CDATA[set input password]]></step>
	<step command="Set"><![CDATA[InputPassword]]><optionalParameter><![CDATA[i]]></optionalParameter></step>
	<step command="Click_On"><![CDATA[OK]]></step>
	<step command="Assert_Content"><![CDATA[Key Value eventTrace onKeyDown(inputPassword); onKeyPress(inputPassword); onKeyUp(inputPassword); OnKeyTest OK]]></step>
	<step command="Comment"></step>
	<step command="Comment"></step>
	<step command="Open_Url"><![CDATA[onkey.html]]></step>
	<step command="Assert_Title"><![CDATA[Wetator / OnKey]]></step>
	<step command="Comment"><![CDATA[set textarea]]></step>
	<step command="Set"><![CDATA[Textarea]]><optionalParameter><![CDATA[i]]></optionalParameter></step>
	<step command="Click_On"><![CDATA[OK]]></step>
	<step command="Assert_Content"><![CDATA[Key Value eventTrace onKeyDown(textarea); onKeyPress(textarea); onKeyUp(textarea); OnKeyTest OK]]></step>
	<step command="Comment"></step>
	<step command="Comment"></step>
	<step command="Open_Url"><![CDATA[onkey.html]]></step>
	<step command="Assert_Title"><![CDATA[Wetator / OnKey]]></step>
	<step command="Comment"><![CDATA[set file upload]]></step>
	<step command="Set"><![CDATA[Upload]]><optionalParameter><![CDATA[misc_files/test_file.txt]]></optionalParameter></step>
	<step command="Click_On"><![CDATA[OK]]></step>
	<step command="Comment"><![CDATA[not onKey event; this is the same the browser does]]></step>
	<step command="Assert_Content"><![CDATA[Key Value eventTrace OnKeyTest OK]]></step>
	<step command="Comment"></step>
	<step command="Comment"></step>
	<step command="Open_Url"><![CDATA[onkey.html]]></step>
	<step command="Assert_Title"><![CDATA[Wetator / OnKey]]></step>
	<step command="Comment"><![CDATA[select single select]]></step>
	<step command="Select"><![CDATA[SingleSelect, option2]]></step>
	<step command="Click_On"><![CDATA[OK]]></step>
	<step command="Comment"><![CDATA[not onKey event; this is the same the browser does]]></step>
	<step command="Assert_Content"><![CDATA[Key Value eventTrace OnKeyTest OK]]></step>
	<step command="Comment"></step>
	<step command="Comment"></step>
	<step command="Open_Url"><![CDATA[onkey.html]]></step>
	<step command="Assert_Title"><![CDATA[Wetator / OnKey]]></step>
	<step command="Comment"><![CDATA[select multiple select]]></step>
	<step command="Select"><![CDATA[MultipleSelect, option2]]></step>
	<step command="Select"><![CDATA[MultipleSelect, option1]]></step>
	<step command="Click_On"><![CDATA[OK]]></step>
	<step command="Comment"><![CDATA[not onKey event; this is the same the browser does]]></step>
	<step command="Assert_Content"><![CDATA[Key Value eventTrace OnKeyTest OK]]></step>
	<step command="Comment"></step>
	<step command="Comment"></step>
	<step command="Open_Url"><![CDATA[onkey.html]]></step>
	<step command="Assert_Title"><![CDATA[Wetator / OnKey]]></step>
	<step command="Comment"><![CDATA[select checkbox]]></step>
	<step command="Select"><![CDATA[Checkbox]]></step>
	<step command="Click_On"><![CDATA[OK]]></step>
	<step command="Comment"><![CDATA[not onKey event; this is the same the browser does]]></step>
	<step command="Assert_Content"><![CDATA[Key Value eventTrace OnKeyTest OK]]></step>
	<step command="Comment"></step>
	<step command="Comment"></step>
	<step command="Open_Url"><![CDATA[onkey.html]]></step>
	<step command="Assert_Title"><![CDATA[Wetator / OnKey]]></step>
	<step command="Comment"><![CDATA[select ratio button]]></step>
	<step command="Select"><![CDATA[Radio1]]></step>
	<step command="Click_On"><![CDATA[OK]]></step>
	<step command="Comment"><![CDATA[not onKey event; this is the same the browser does]]></step>
	<step command="Assert_Content"><![CDATA[Key Value eventTrace OnKeyTest OK]]></step>
	<step command="Comment"></step>
	<step command="Comment"></step>
	<step command="Comment"></step>
	<step command="Comment"></step>
	<step command="Open_Url"><![CDATA[onkey.html]]></step>
	<step command="Assert_Title"><![CDATA[Wetator / OnKey]]></step>
	<step command="Comment"><![CDATA[set input text with default]]></step>
	<step command="Set"><![CDATA[InputText with default]]><optionalParameter><![CDATA[i]]></optionalParameter></step>
	<step command="Click_On"><![CDATA[OK]]></step>
	<step command="Assert_Content"><![CDATA[Key Value eventTrace onKeyDown(inputTextDefault); onKeyPress(inputTextDefault); onKeyUp(inputTextDefault); OnKeyTest OK]]></step>
	<step command="Comment"></step>
	<step command="Comment"></step>
	<step command="Open_Url"><![CDATA[onkey.html]]></step>
	<step command="Assert_Title"><![CDATA[Wetator / OnKey]]></step>
	<step command="Comment"><![CDATA[set input password with default]]></step>
	<step command="Set"><![CDATA[InputPassword with default]]><optionalParameter><![CDATA[i]]></optionalParameter></step>
	<step command="Click_On"><![CDATA[OK]]></step>
	<step command="Assert_Content"><![CDATA[Key Value eventTrace onKeyDown(inputPasswordDefault); onKeyPress(inputPasswordDefault); onKeyUp(inputPasswordDefault); OnKeyTest OK]]></step>
	<step command="Comment"></step>
	<step command="Comment"></step>
	<step command="Open_Url"><![CDATA[onkey.html]]></step>
	<step command="Assert_Title"><![CDATA[Wetator / OnKey]]></step>
	<step command="Comment"><![CDATA[set textarea with default]]></step>
	<step command="Set"><![CDATA[Textarea with default]]><optionalParameter><![CDATA[i]]></optionalParameter></step>
	<step command="Click_On"><![CDATA[OK]]></step>
	<step command="Assert_Content"><![CDATA[Key Value eventTrace onKeyDown(textareaDefault); onKeyPress(textareaDefault); onKeyUp(textareaDefault); OnKeyTest OK]]></step>
	<step command="Comment"></step>
	<step command="Comment"></step>
	<step command="Open_Url"><![CDATA[onkey.html]]></step>
	<step command="Assert_Title"><![CDATA[Wetator / OnKey]]></step>
	<step command="Comment"><![CDATA[set file upload with default]]></step>
	<step command="Set"><![CDATA[Upload with default]]><optionalParameter><![CDATA[misc_files/test_file.txt]]></optionalParameter></step>
	<step command="Click_On"><![CDATA[OK]]></step>
	<step command="Comment"><![CDATA[not onKey event; this is the same the browser does]]></step>
	<step command="Assert_Content"><![CDATA[Key Value eventTrace OnKeyTest OK]]></step>
</testcase>