<?xml version="1.0" encoding="UTF-8"?><!DOCTYPE testcase SYSTEM "dtd/testcase.dtd">
<testcase>
	<step command="Open_Url"><![CDATA[onfocus_onblur.html]]></step>
	<step command="Assert_Title"><![CDATA[Wetator / OnFocus OnBlur]]></step>
	<step command="Comment"><![CDATA[simple submit]]></step>
	<step command="Click_On"><![CDATA[OK]]></step>
	<step command="Assert_Content"><![CDATA[Key, Value, eventTrace, OnFocusOnBlurTest, OK]]></step>
	<step command="Comment"></step>
	<step command="Comment"></step>
	<step command="Open_Url"><![CDATA[onfocus_onblur.html]]></step>
	<step command="Assert_Title"><![CDATA[Wetator / OnFocus OnBlur]]></step>
	<step command="Comment"><![CDATA[set input text]]></step>
	<step command="Set"><![CDATA[InputText]]><optionalParameter><![CDATA[testValue]]></optionalParameter></step>
	<step command="Click_On"><![CDATA[OK]]></step>
	<step command="Assert_Content"><![CDATA[Key, Value, eventTrace, onFocus(inputText);onBlur(inputText);, OnFocusOnBlurTest, OK]]></step>
	<step command="Comment"></step>
	<step command="Comment"></step>
	<step command="Open_Url"><![CDATA[onfocus_onblur.html]]></step>
	<step command="Assert_Title"><![CDATA[Wetator / OnFocus OnBlur]]></step>
	<step command="Comment"><![CDATA[InputText try overwrite]]></step>
	<step command="Set"><![CDATA[InputPassword]]><optionalParameter><![CDATA[testValue]]></optionalParameter></step>
	<step command="Click_On"><![CDATA[OK]]></step>
	<step command="Assert_Content"><![CDATA[Key, Value, eventTrace, onFocus(inputPassword);onBlur(inputPassword);, OnFocusOnBlurTest, OK]]></step>
	<step command="Comment"></step>
	<step command="Comment"></step>
	<step command="Open_Url"><![CDATA[onfocus_onblur.html]]></step>
	<step command="Assert_Title"><![CDATA[Wetator / OnFocus OnBlur]]></step>
	<step command="Comment"><![CDATA[set textarea]]></step>
	<step command="Set"><![CDATA[Textarea]]><optionalParameter><![CDATA[testValue]]></optionalParameter></step>
	<step command="Click_On"><![CDATA[OK]]></step>
	<step command="Assert_Content"><![CDATA[Key, Value, eventTrace, onFocus(textarea);onBlur(textarea);, OnFocusOnBlurTest, OK]]></step>
	<step command="Comment"></step>
	<step command="Comment"></step>
	<step command="Open_Url"><![CDATA[onfocus_onblur.html]]></step>
	<step command="Assert_Title"><![CDATA[Wetator / OnFocus OnBlur]]></step>
	<step command="Comment"><![CDATA[set file upload]]></step>
	<step command="Set"><![CDATA[Upload]]><optionalParameter><![CDATA[misc_files/test_file.txt]]></optionalParameter></step>
	<step command="Click_On"><![CDATA[OK]]></step>
	<step command="Comment"><![CDATA[not onFocus/onBlur event; this is the same the browser does]]></step>
	<step command="Assert_Content"><![CDATA[Key, Value, eventTrace, OnFocusOnBlurTest, OK]]></step>
	<step command="Comment"></step>
	<step command="Comment"></step>
	<step command="Open_Url"><![CDATA[onfocus_onblur.html]]></step>
	<step command="Assert_Title"><![CDATA[Wetator / OnFocus OnBlur]]></step>
	<step command="Comment"><![CDATA[select single select]]></step>
	<step command="Select"><![CDATA[SingleSelect, option2]]></step>
	<step command="Click_On"><![CDATA[OK]]></step>
	<step command="Assert_Content"><![CDATA[Key, Value, eventTrace, onFocus(singleSelect);onBlur(singleSelect);, OnFocusOnBlurTest, OK]]></step>
	<step command="Comment"></step>
	<step command="Comment"></step>
	<step command="Open_Url"><![CDATA[onfocus_onblur.html]]></step>
	<step command="Assert_Title"><![CDATA[Wetator / OnFocus OnBlur]]></step>
	<step command="Comment"><![CDATA[select multiple select]]></step>
	<step command="Select"><![CDATA[MultipleSelect, option2]]></step>
	<step command="Select"><![CDATA[MultipleSelect, option1]]></step>
	<step command="Click_On"><![CDATA[OK]]></step>
	<step command="Assert_Content"><![CDATA[Key, Value, eventTrace, onFocus(multipleSelect);onBlur(multipleSelect);, OnFocusOnBlurTest, OK]]></step>
	<step command="Comment"></step>
	<step command="Comment"></step>
	<step command="Open_Url"><![CDATA[onfocus_onblur.html]]></step>
	<step command="Assert_Title"><![CDATA[Wetator / OnFocus OnBlur]]></step>
	<step command="Comment"><![CDATA[select checkbox]]></step>
	<step command="Select"><![CDATA[Checkbox]]></step>
	<step command="Click_On"><![CDATA[OK]]></step>
	<step command="Assert_Content"><![CDATA[Key, Value, eventTrace, onFocus(checkbox);onBlur(checkbox);, OnFocusOnBlurTest, OK]]></step>
	<step command="Comment"></step>
	<step command="Comment"></step>
	<step command="Open_Url"><![CDATA[onfocus_onblur.html]]></step>
	<step command="Assert_Title"><![CDATA[Wetator / OnFocus OnBlur]]></step>
	<step command="Comment"><![CDATA[select ratio button]]></step>
	<step command="Select"><![CDATA[Radio1]]></step>
	<step command="Click_On"><![CDATA[OK]]></step>
	<step command="Assert_Content"><![CDATA[Key, Value, eventTrace, onFocus(Radio1);onBlur(Radio1);, OnFocusOnBlurTest, OK]]></step>
	<step command="Comment"></step>
	<step command="Comment"></step>
	<step command="Open_Url"><![CDATA[onfocus_onblur.html]]></step>
	<step command="Assert_Title"><![CDATA[Wetator / OnFocus OnBlur]]></step>
	<step command="Comment"><![CDATA[select ratio button]]></step>
	<step command="Select"><![CDATA[Radio2]]></step>
	<step command="Click_On"><![CDATA[OK]]></step>
	<step command="Assert_Content"><![CDATA[Key, Value, eventTrace, onFocus(Radio2);onBlur(Radio2);, OnFocusOnBlurTest, OK]]></step>
	<step command="Comment"></step>
	<step command="Comment"></step>
	<step command="Open_Url"><![CDATA[onfocus_onblur.html]]></step>
	<step command="Assert_Title"><![CDATA[Wetator / OnFocus OnBlur]]></step>
	<step command="Comment"><![CDATA[select ratio button]]></step>
	<step command="Select"><![CDATA[Radio1]]></step>
	<step command="Select"><![CDATA[Radio2]]></step>
	<step command="Click_On"><![CDATA[OK]]></step>
	<step command="Assert_Content"><![CDATA[Key, Value, eventTrace, onFocus(Radio1);onBlur(Radio1); onFocus(Radio2);onBlur(Radio2);, OnFocusOnBlurTest, OK]]></step>
	<step command="Comment"></step>
	<step command="Comment"></step>
</testcase>