<?xml version="1.0" encoding="UTF-8"?><!DOCTYPE testcase SYSTEM "dtd/testcase.dtd">
<testcase>
	<step command="Open_Url"><![CDATA[assert_selected.html]]></step>
	<step command="Assert_Title"><![CDATA[Wetator / Assert Selected]]></step>
	<step command="Comment"><![CDATA[RadioButton with name]]></step>
	<step command="Comment"><![CDATA[not possible]]></step>
	<step command="Comment"></step>
	<step command="Comment"></step>
	<step command="Comment"></step>
	<step command="Comment"></step>
	<step command="Open_Url"><![CDATA[assert_selected.html]]></step>
	<step command="Assert_Title"><![CDATA[Wetator / Assert Selected]]></step>
	<step command="Comment"><![CDATA[RadioButton with id]]></step>
	<step command="Assert_Selected"><![CDATA[radioId1]]></step>
	<step command="Comment"></step>
	<step command="Comment"></step>
	<step command="Open_Url"><![CDATA[assert_selected.html]]></step>
	<step command="Assert_Title"><![CDATA[Wetator / Assert Selected]]></step>
	<step command="Comment"><![CDATA[RadioButton identified by label]]></step>
	<step command="Assert_Selected"><![CDATA[Radio2 Label]]></step>
	<step command="Comment"></step>
	<step command="Comment"></step>
	<step command="Open_Url"><![CDATA[assert_selected.html]]></step>
	<step command="Assert_Title"><![CDATA[Wetator / Assert Selected]]></step>
	<step command="Comment"><![CDATA[RadioButton identified by layout directly after]]></step>
	<step command="Assert_Selected"><![CDATA[RadioButton1 LayoutLabel after]]></step>
	<step command="Comment"></step>
	<step command="Comment"></step>
	<step command="Open_Url"><![CDATA[assert_selected.html]]></step>
	<step command="Assert_Title"><![CDATA[Wetator / Assert Selected]]></step>
	<step command="Comment"><![CDATA[RadioButton identified by layout directly after formated]]></step>
	<step command="Assert_Selected"><![CDATA[RadioButton1 LayoutLabel after formated]]></step>
	<step command="Comment"></step>
	<step command="Comment"></step>
	<step command="Open_Url"><![CDATA[assert_selected.html]]></step>
	<step command="Assert_Title"><![CDATA[Wetator / Assert Selected]]></step>
	<step command="Comment"><![CDATA[RadioButton identified by layout at right]]></step>
	<step command="Assert_Selected"><![CDATA[RadioButton2 LayoutLabel at right]]></step>
	<step command="Comment"></step>
	<step command="Comment"></step>
	<step command="Open_Url"><![CDATA[assert_selected.html]]></step>
	<step command="Assert_Title"><![CDATA[Wetator / Assert Selected]]></step>
	<step command="Comment"><![CDATA[RadioButton identified by layout at right formated]]></step>
	<step command="Assert_Selected"><![CDATA[RadioButton1 LayoutLabel right formated]]></step>
	<step command="Comment"></step>
	<step command="Comment"></step>
	<step command="Comment"></step>
	<step command="Comment"></step>
</testcase>