<?xml version="1.0" encoding="UTF-8"?>
<!DOCTYPE testcase SYSTEM "dtd/testcase.dtd">

<testcase>
    <step command="Open_Url">assert_selected.html</step>
    <step command="Assert_Title">Wetator / Assert Selected</step>
    <step command="Comment">CheckBox with name</step>
    <step command="Assert_Selected">checkBox_Name</step>
    <step command="Comment"></step>
    <step command="Comment"></step>
    <step command="Open_Url">assert_selected.html</step>
    <step command="Assert_Title">Wetator / Assert Selected</step>
    <step command="Comment">CheckBox with id</step>
    <step command="Assert_Selected">checkBox_Id</step>
    <step command="Comment"></step>
    <step command="Comment"></step>
    <step command="Open_Url">assert_selected.html</step>
    <step command="Assert_Title">Wetator / Assert Selected</step>
    <step command="Comment">CheckBox identified by label</step>
    <step command="Assert_Selected">CheckBox Label</step>
    <step command="Comment"></step>
    <step command="Comment"></step>
    <step command="Open_Url">assert_selected.html</step>
    <step command="Assert_Title">Wetator / Assert Selected</step>
    <step command="Comment">CheckBox identified by layout directly after</step>
    <step command="Assert_Selected">CheckBox LayoutLabel after</step>
    <step command="Comment"></step>
    <step command="Comment"></step>
    <step command="Open_Url">assert_selected.html</step>
    <step command="Assert_Title">Wetator / Assert Selected</step>
    <step command="Comment">CheckBox identified by layout directly after formated</step>
    <step command="Assert_Selected">CheckBox LayoutLabel after formated</step>
    <step command="Comment"></step>
    <step command="Comment"></step>
    <step command="Open_Url">assert_selected.html</step>
    <step command="Assert_Title">Wetator / Assert Selected</step>
    <step command="Comment">CheckBox identified by layout at bottom</step>
    <step command="Assert_Selected">CheckBox LayoutLabel at bottom</step>
    <step command="Comment"></step>
    <step command="Comment"></step>
    <step command="Open_Url">assert_selected.html</step>
    <step command="Assert_Title">Wetator / Assert Selected</step>
    <step command="Comment">CheckBox identified by layout at bottom formated</step>
    <step command="Assert_Selected">CheckBox LayoutLabel at bottom formated</step>
    <step command="Comment"></step>
    <step command="Comment"></step>
    <step command="Open_Url">assert_selected.html</step>
    <step command="Assert_Title">Wetator / Assert Selected</step>
    <step command="Comment">CheckBox identified by layout at right</step>
    <step command="Assert_Selected">CheckBox LayoutLabel at right</step>
    <step command="Comment"></step>
    <step command="Comment"></step>
    <step command="Open_Url">assert_selected.html</step>
    <step command="Assert_Title">Wetator / Assert Selected</step>
    <step command="Comment">CheckBox identified by layout at right formated</step>
    <step command="Assert_Selected">CheckBox LayoutLabel at right formated</step>
    <step command="Comment"></step>
    <step command="Comment"></step>
    <step command="Comment"></step>
    <step command="Comment"></step>
</testcase>