<?xml version="1.0" encoding="UTF-8"?><!DOCTYPE testcase SYSTEM "dtd/testcase.dtd">
<testcase>
	<step command="Open_Url"><![CDATA[ajax/prototype/prototype_ajax.html]]></step>
	<step command="Assert_Title"><![CDATA[Wetator / AJAX with Prototype]]></step>
	<step command="Comment"><![CDATA[add content via AJAX]]></step>
	<step command="Comment"><![CDATA[check the original content]]></step>
	<step command="Assert_Content"><![CDATA[Click to start AJAX demo...]]></step>
	<step command="Click_On"><![CDATA[Click to start AJAX demo]]></step>
	<step command="Comment"></step>
	<step command="Assert_Content"><![CDATA[This is some text transferred to the client via AJAX.]]></step>
	<step command="Comment"></step>
	<step command="Comment"></step>
	<step command="Open_Url"><![CDATA[ajax/prototype/prototype_ajax.html]]></step>
	<step command="Assert_Title"><![CDATA[Wetator / AJAX with Prototype]]></step>
	<step command="Comment"><![CDATA[change content via javascript loaded with AJAX]]></step>
	<step command="Comment"><![CDATA[check the original content]]></step>
	<step command="Assert_Content"><![CDATA[Click to start AJAX Javascript demo...]]></step>
	<step command="Click_On"><![CDATA[Click to start AJAX Javascript demo]]></step>
	<step command="Comment"></step>
	<step command="Assert_Content"><![CDATA[Click to start AJAX Javascript demo... Javascript Execute]]></step>
</testcase>