<?xml version="1.0" encoding="UTF-8"?><!DOCTYPE testcase SYSTEM "dtd/testcase.dtd">
<testcase>
	<step command="Comment"></step>
	<step command="Open_Url"><![CDATA[mouse_over.html]]></step>
	<step command="Assert_Title"><![CDATA[Wetator / Mouse Over]]></step>
	<step command="Comment"><![CDATA[button is not visible]]></step>
	<step command="Assert_Fail"><![CDATA[Click On, No html element found for 'Submit'.]]><optionalParameter><![CDATA[Submit]]></optionalParameter></step>
	<step command="Comment"><![CDATA[move mouse over the button]]></step>
	<step command="Mouse_Over"><![CDATA[Gurkensalat]]></step>
	<step command="Click_On"><![CDATA[Submit]]></step>
	<step command="Assert_Content"><![CDATA[GET Parameters, Key, Value, b_plaintext_name, Submit]]></step>
	<step command="Comment"></step>
	<step command="Comment"></step>
	<step command="Open_Url"><![CDATA[mouse_over.html]]></step>
	<step command="Assert_Title"><![CDATA[Wetator / Mouse Over]]></step>
	<step command="Comment"><![CDATA[button is not visible]]></step>
	<step command="Assert_Fail"><![CDATA[Click On, No html element found for 'Submit'.]]><optionalParameter><![CDATA[Submit]]></optionalParameter></step>
	<step command="Comment"><![CDATA[move mouse over the button]]></step>
	<step command="Mouse_Over"><![CDATA[xt is style]]></step>
	<step command="Click_On"><![CDATA[Submit]]></step>
	<step command="Assert_Content"><![CDATA[GET Parameters, Key, Value, b_formatedtext_name, Submit]]></step>
	<step command="Comment"></step>
	<step command="Comment"></step>
	<step command="Open_Url"><![CDATA[mouse_over.html]]></step>
	<step command="Assert_Title"><![CDATA[Wetator / Mouse Over]]></step>
	<step command="Comment"><![CDATA[button is not visible]]></step>
	<step command="Assert_Fail"><![CDATA[Click On, No html element found for 'Submit'.]]><optionalParameter><![CDATA[Submit]]></optionalParameter></step>
	<step command="Comment"><![CDATA[move mouse over the button]]></step>
	<step command="Mouse_Over"><![CDATA[Button will go away]]></step>
	<step command="Click_On"><![CDATA[Submit]]></step>
	<step command="Assert_Content"><![CDATA[GET Parameters, Key, Value, b_timeout_name, Submit]]></step>
</testcase>