<?xml version="1.0" encoding="UTF-8"?><!DOCTYPE testcase SYSTEM "dtd/testcase.dtd">
<testcase>
	<step command="Open_Url"><![CDATA[ajax/jquery/jquery_ajax.html]]></step>
	<step command="Assert_Title"><![CDATA[Wetator / AJAX with jQuery]]></step>
	<step command="Comment"><![CDATA[blank at start]]></step>
	<step command="Assert_Title"><![CDATA[Wetator / AJAX with jQuery]]></step>
	<step command="Comment"><![CDATA[blank at end]]></step>
	<step command="Assert_Title"><![CDATA[Wetator / AJAX with jQuery]]></step>
	<step command="Comment"><![CDATA[blank at start and end]]></step>
	<step command="Assert_Title"><![CDATA[Wetator / AJAX with jQuery]]></step>
	<step command="Comment"><![CDATA[blanks inside]]></step>
	<step command="Assert_Title"><![CDATA[Wetator / AJAX with jQuery]]></step>
</testcase>