<?xml version="1.0" encoding="UTF-8"?>
<!DOCTYPE testcase SYSTEM "dtd/testcase.dtd">

<testcase>
    <step command="Open_Url">select.html</step>
    <step command="Assert_Title">Wetator / Select</step>
    <step command="Comment">MultipleSelect with name</step>
    <step command="Select">multipleSelect_Name[], option2</step>
    <step command="Select">multipleSelect_Name[], option4</step>
    <step command="Click_On">MultipleSelectNameTest</step>
    <step command="Assert_Content">GET Parameters, Key, Value, multipleSelect_Name, o_value2, o_value4, MultipleSelectNameTest, OK</step>
    <step command="Comment"></step>
    <step command="Open_Url">select.html</step>
    <step command="Assert_Title">Wetator / Select</step>
    <step command="Comment">MultipleSelectOptGroup with name</step>
    <step command="Select">multipleSelectOptgroup_Name[], blue</step>
    <step command="Select">multipleSelectOptgroup_Name[], value1</step>
    <step command="Select">multipleSelectOptgroup_Name[], value2</step>
    <step command="Click_On">MultipleSelectOptGroupNameTest</step>
    <step command="Assert_Content">GET Parameters, Key, Value, multipleSelectOptgroup_Name, o_blue, o_value1, o_value2, MultipleSelectOptGroupNameTest, OK</step>
    <step command="Comment"></step>
    <step command="Comment"></step>
    <step command="Open_Url">select.html</step>
    <step command="Assert_Title">Wetator / Select</step>
    <step command="Comment">MultipleSelect with id</step>
    <step command="Select">multipleSelect_Id, option3</step>
    <step command="Select">multipleSelect_Id, option4</step>
    <step command="Click_On">MultipleSelectIdTest</step>
    <step command="Assert_Content">GET Parameters, Key, Value, multipleSelect_Id, o_value3, o_value4, MultipleSelectIdTest, OK</step>
    <step command="Comment"></step>
    <step command="Comment"></step>
    <step command="Open_Url">select.html</step>
    <step command="Assert_Title">Wetator / Select</step>
    <step command="Comment">MultipleSelect with default selection</step>
    <step command="Select">multipleSelect_NameValue[], option4</step>
    <step command="Select">multipleSelect_NameValue[], option1</step>
    <step command="Click_On">MultipleSelectNameValueTest</step>
    <step command="Assert_Content">GET Parameters, Key, Value, multipleSelect_NameValue, o_value1, o_value4, MultipleSelectNameValueTest, OK</step>
    <step command="Comment"></step>
    <step command="Comment"></step>
    <step command="Open_Url">select.html</step>
    <step command="Assert_Title">Wetator / Select</step>
    <step command="Comment">MultipleSelect identified by label</step>
    <step command="Select">MultipleSelect Label, option1</step>
    <step command="Select">MultipleSelect Label, option2</step>
    <step command="Click_On">MultipleSelectLabelTest</step>
    <step command="Assert_Content">GET Parameters, Key, Value, multipleSelect_Label, o_value1, o_value2,  MultipleSelectLabelTest, OK</step>
    <step command="Comment"></step>
    <step command="Comment"></step>
    <step command="Open_Url">select.html</step>
    <step command="Assert_Title">Wetator / Select</step>
    <step command="Comment">MultipleSelect identified by layout directly before</step>
    <step command="Select">MultipleSelect LayoutLabel before, option3</step>
    <step command="Select">MultipleSelect LayoutLabel before, option2</step>
    <step command="Click_On">MultipleSelectLayoutBeforeTest</step>
    <step command="Assert_Content">GET Parameters, Key, Value, multipleSelect_LayoutBefore, o_value2, o_value3, MultipleSelectLayoutBeforeTest, OK</step>
    <step command="Comment"></step>
    <step command="Comment"></step>
    <step command="Open_Url">select.html</step>
    <step command="Assert_Title">Wetator / Select</step>
    <step command="Comment">MultipleSelect identified by layout directly before formated</step>
    <step command="Select">MultipleSelect LayoutLabel before formated, option2</step>
    <step command="Click_On">MultipleSelectLayoutBeforeFormatedTest</step>
    <step command="Assert_Content">GET Parameters, Key, Value, multipleSelect_LayoutBeforeFormated, o_value2, MultipleSelectLayoutBeforeFormatedTest, OK</step>
    <step command="Comment"></step>
    <step command="Comment"></step>
    <step command="Open_Url">select.html</step>
    <step command="Assert_Title">Wetator / Select</step>
    <step command="Comment">MultipleSelect identified by layout at top</step>
    <step command="Select">MultipleSelect LayoutLabel at top, option3</step>
    <step command="Click_On">MultipleSelectLayoutTopTest</step>
    <step command="Assert_Content">GET Parameters, Key, Value, multipleSelect_LayoutTop, o_value3, MultipleSelectLayoutTopTest, OK</step>
    <step command="Comment"></step>
    <step command="Comment"></step>
    <step command="Open_Url">select.html</step>
    <step command="Assert_Title">Wetator / Select</step>
    <step command="Comment">MultipleSelect identified by layout at top formated</step>
    <step command="Select">MultipleSelect LayoutLabel at top formated, option4</step>
    <step command="Select">MultipleSelect LayoutLabel at top formated, option1</step>
    <step command="Click_On">MultipleSelectLayoutTopFormatedTest</step>
    <step command="Assert_Content">GET Parameters, Key, Value, multipleSelect_LayoutTopFormated, o_value1, o_value4, MultipleSelectLayoutTopFormatedTest, OK</step>
    <step command="Comment"></step>
    <step command="Comment"></step>
    <step command="Open_Url">select.html</step>
    <step command="Assert_Title">Wetator / Select</step>
    <step command="Comment">MultipleSelect identified by layout at left</step>
    <step command="Select">MultipleSelect LayoutLabel at left, option1</step>
    <step command="Select">MultipleSelect LayoutLabel at left, option3</step>
    <step command="Click_On">MultipleSelectLayoutLeftTest</step>
    <step command="Assert_Content">GET Parameters, Key, Value, multipleSelect_LayoutLeft, o_value1, o_value3, MultipleSelectLayoutLeftTest, OK</step>
    <step command="Comment"></step>
    <step command="Comment"></step>
    <step command="Open_Url">select.html</step>
    <step command="Assert_Title">Wetator / Select</step>
    <step command="Comment">MultipleSelect identified by layout at left formated</step>
    <step command="Select">MultipleSelect LayoutLabel at left formated, option2</step>
    <step command="Select">MultipleSelect LayoutLabel at left formated, option4</step>
    <step command="Click_On">MultipleSelectLayoutLeftFormatedTest</step>
    <step command="Assert_Content">GET Parameters, Key, Value, multipleSelect_LayoutLeftFormated, o_value2, o_value4, MultipleSelectLayoutLeftFormatedTest, OK</step>
    <step command="Comment"></step>
    <step command="Comment"></step>
    <step command="Comment"></step>
    <step command="Comment"></step>
</testcase>