<?xml version="1.0" encoding="UTF-8"?><!DOCTYPE testcase SYSTEM "dtd/testcase.dtd">
<testcase>
	<step command="Open_Url"><![CDATA[select.html]]></step>
	<step command="Assert_Title"><![CDATA[Wetator / Select]]></step>
	<step command="Comment"><![CDATA[RadioButton with name]]></step>
	<step command="Comment"><![CDATA[not possible]]></step>
	<step command="Comment"></step>
	<step command="Comment"></step>
	<step command="Comment"></step>
	<step command="Comment"></step>
	<step command="Open_Url"><![CDATA[select.html]]></step>
	<step command="Assert_Title"><![CDATA[Wetator / Select]]></step>
	<step command="Comment"><![CDATA[RadioButton with id]]></step>
	<step command="Select"><![CDATA[radioId2]]></step>
	<step command="Click_On"><![CDATA[RadioButtonIdTest]]></step>
	<step command="Assert_Content"><![CDATA[GET Parameters, Key, Value, radioButton_Id, r_value2, RadioButtonIdTest, OK]]></step>
	<step command="Comment"></step>
	<step command="Comment"></step>
	<step command="Open_Url"><![CDATA[select.html]]></step>
	<step command="Assert_Title"><![CDATA[Wetator / Select]]></step>
	<step command="Comment"><![CDATA[RadioButton with default selection]]></step>
	<step command="Select"><![CDATA[radioIdValue1]]></step>
	<step command="Click_On"><![CDATA[RadioButtonIdValueTest]]></step>
	<step command="Assert_Content"><![CDATA[GET Parameters, Key, Value, radioButton_IdValue, r_value1, RadioButtonIdValueTest, OK]]></step>
	<step command="Comment"></step>
	<step command="Comment"></step>
	<step command="Open_Url"><![CDATA[select.html]]></step>
	<step command="Assert_Title"><![CDATA[Wetator / Select]]></step>
	<step command="Comment"><![CDATA[RadioButton identified by label]]></step>
	<step command="Select"><![CDATA[Radio2 Label]]></step>
	<step command="Click_On"><![CDATA[RadioButtonLabelTest]]></step>
	<step command="Assert_Content"><![CDATA[GET Parameters, Key, Value, radioButton_Label, r_value2, RadioButtonLabelTest, OK]]></step>
	<step command="Comment"></step>
	<step command="Comment"></step>
	<step command="Open_Url"><![CDATA[select.html]]></step>
	<step command="Assert_Title"><![CDATA[Wetator / Select]]></step>
	<step command="Comment"><![CDATA[RadioButton identified by layout directly after]]></step>
	<step command="Select"><![CDATA[RadioButton1 LayoutLabel after]]></step>
	<step command="Click_On"><![CDATA[RadioButtonLayoutAfterTest]]></step>
	<step command="Assert_Content"><![CDATA[GET Parameters, Key, Value, radioButton_LayoutAfter, r_value1, RadioButtonLayoutAfterTest, OK]]></step>
	<step command="Comment"></step>
	<step command="Comment"></step>
	<step command="Open_Url"><![CDATA[select.html]]></step>
	<step command="Assert_Title"><![CDATA[Wetator / Select]]></step>
	<step command="Comment"><![CDATA[RadioButton identified by layout directly after formated]]></step>
	<step command="Select"><![CDATA[RadioButton2 LayoutLabel after formated]]></step>
	<step command="Click_On"><![CDATA[RadioButtonLayoutAfterFormatedTest]]></step>
	<step command="Assert_Content"><![CDATA[GET Parameters, Key, Value, radioButton_LayoutFormatedAfter, r_value2, RadioButtonLayoutAfterFormatedTest, OK]]></step>
	<step command="Comment"></step>
	<step command="Comment"></step>
	<step command="Open_Url"><![CDATA[select.html]]></step>
	<step command="Assert_Title"><![CDATA[Wetator / Select]]></step>
	<step command="Comment"><![CDATA[RadioButton identified by layout at right]]></step>
	<step command="Select"><![CDATA[RadioButton1 LayoutLabel at right]]></step>
	<step command="Click_On"><![CDATA[RadioButtonLayoutRightTest]]></step>
	<step command="Assert_Content"><![CDATA[GET Parameters, Key, Value, radioButton_LayoutRight, r_value1, RadioButtonLayoutRightTest, OK]]></step>
	<step command="Comment"></step>
	<step command="Comment"></step>
	<step command="Open_Url"><![CDATA[select.html]]></step>
	<step command="Assert_Title"><![CDATA[Wetator / Select]]></step>
	<step command="Comment"><![CDATA[RadioButton identified by layout at right formated]]></step>
	<step command="Select"><![CDATA[RadioButton2 LayoutLabel right formated]]></step>
	<step command="Click_On"><![CDATA[RadioButtonLayoutRightFormatedTest]]></step>
	<step command="Assert_Content"><![CDATA[GET Parameters, Key, Value, radioButton_LayoutRightFormated, r_value2, RadioButtonLayoutRightFormatedTest, OK]]></step>
	<step command="Comment"></step>
	<step command="Comment"></step>
	<step command="Comment"></step>
	<step command="Comment"></step>
</testcase>