<?xml version="1.0" encoding="UTF-8"?><!DOCTYPE testcase SYSTEM "dtd/testcase.dtd">
<testcase>
	<step command="Open_Url"><![CDATA[assert_disabled.html]]></step>
	<step command="Assert_Title"><![CDATA[Wetator / Assert Disabled]]></step>
	<step command="Comment"><![CDATA[ ]]></step>
	<step command="Comment"><![CDATA[ ]]></step>
	<step command="Comment"><![CDATA[Text Input]]></step>
	<step command="Comment"><![CDATA[InputText with name]]></step>
	<step command="Assert_Disabled"><![CDATA[inputText_Name]]></step>
	<step command="Comment"><![CDATA[InputText with name]]></step>
	<step command="Assert_Disabled"><![CDATA[inputText_Name]]></step>
	<step command="Comment"><![CDATA[InputText with id]]></step>
	<step command="Assert_Disabled"><![CDATA[inputText_Id]]></step>
	<step command="Comment"><![CDATA[InputText identified by label]]></step>
	<step command="Assert_Disabled"><![CDATA[InputText Label]]></step>
	<step command="Comment"><![CDATA[InputText identified by layout directly before]]></step>
	<step command="Assert_Disabled"><![CDATA[InputText LayoutLabel before]]></step>
	<step command="Comment"><![CDATA[InputText identified by layout directly before formated]]></step>
	<step command="Assert_Disabled"><![CDATA[InputText LayoutLabel before formated]]></step>
	<step command="Comment"><![CDATA[InputText identified by layout at top]]></step>
	<step command="Assert_Disabled"><![CDATA[InputText LayoutLabel at top]]></step>
	<step command="Comment"><![CDATA[InputText identified by layout at top formated]]></step>
	<step command="Assert_Disabled"><![CDATA[InputText LayoutLabel at top formated]]></step>
	<step command="Comment"><![CDATA[InputText identified by layout at left]]></step>
	<step command="Assert_Disabled"><![CDATA[InputText LayoutLabel at left]]></step>
	<step command="Comment"><![CDATA[InputText identified by layout at left formated]]></step>
	<step command="Assert_Disabled"><![CDATA[InputText LayoutLabel at left formated]]></step>
	<step command="Comment"><![CDATA[InputText identified by layout at left formated]]></step>
	<step command="Assert_Disabled"><![CDATA[InputText LayoutLabel at left formated]]></step>
	<step command="Comment"><![CDATA[ ]]></step>
	<step command="Comment"><![CDATA[ ]]></step>
	<step command="Comment"><![CDATA[Password Input]]></step>
	<step command="Comment"><![CDATA[InputPassword with name]]></step>
	<step command="Assert_Disabled"><![CDATA[inputPassword_Name]]></step>
	<step command="Comment"><![CDATA[InputPassword with id]]></step>
	<step command="Assert_Disabled"><![CDATA[inputPassword_Id]]></step>
	<step command="Comment"><![CDATA[InputPassword identified by label]]></step>
	<step command="Assert_Disabled"><![CDATA[InputPassword Label]]></step>
	<step command="Comment"><![CDATA[InputPassword identified by layout directly before]]></step>
	<step command="Assert_Disabled"><![CDATA[InputPassword LayoutLabel before]]></step>
	<step command="Comment"><![CDATA[InputPassword identified by layout directly before formated]]></step>
	<step command="Assert_Disabled"><![CDATA[InputPassword LayoutLabel before formated]]></step>
	<step command="Comment"><![CDATA[InputPassword identified by layout at top]]></step>
	<step command="Assert_Disabled"><![CDATA[InputPassword LayoutLabel at top]]></step>
	<step command="Comment"><![CDATA[InputPassword identified by layout at top formated]]></step>
	<step command="Assert_Disabled"><![CDATA[InputPassword LayoutLabel at top formated]]></step>
	<step command="Comment"><![CDATA[InputPassword identified by layout at left]]></step>
	<step command="Assert_Disabled"><![CDATA[InputPassword LayoutLabel at left]]></step>
	<step command="Comment"><![CDATA[InputPassword identified by layout at left formated]]></step>
	<step command="Assert_Disabled"><![CDATA[InputPassword LayoutLabel at left formated]]></step>
	<step command="Comment"><![CDATA[ ]]></step>
	<step command="Comment"><![CDATA[ ]]></step>
	<step command="Comment"><![CDATA[TextArea Input]]></step>
	<step command="Comment"><![CDATA[TextArea with name]]></step>
	<step command="Assert_Disabled"><![CDATA[textArea_Name]]></step>
	<step command="Comment"><![CDATA[TextArea with id]]></step>
	<step command="Assert_Disabled"><![CDATA[textArea_Id]]></step>
	<step command="Comment"><![CDATA[TextArea identified by label]]></step>
	<step command="Assert_Disabled"><![CDATA[TextArea Label]]></step>
	<step command="Comment"><![CDATA[TextArea identified by layout directly before]]></step>
	<step command="Assert_Disabled"><![CDATA[TextArea LayoutLabel before]]></step>
	<step command="Comment"><![CDATA[TextArea identified by layout directly before formated]]></step>
	<step command="Assert_Disabled"><![CDATA[TextArea LayoutLabel before formated]]></step>
	<step command="Comment"><![CDATA[TextArea identified by layout at top]]></step>
	<step command="Assert_Disabled"><![CDATA[TextArea LayoutLabel at top]]></step>
	<step command="Comment"><![CDATA[TextArea identified by layout at top formated]]></step>
	<step command="Assert_Disabled"><![CDATA[TextArea LayoutLabel at top formated]]></step>
	<step command="Comment"><![CDATA[TextArea identified by layout at left]]></step>
	<step command="Assert_Disabled"><![CDATA[TextArea LayoutLabel at left]]></step>
	<step command="Comment"><![CDATA[TextArea identified by layout at left formated]]></step>
	<step command="Assert_Disabled"><![CDATA[TextArea LayoutLabel at left formated]]></step>
	<step command="Comment"></step>
	<step command="Comment"></step>
	<step command="Comment"><![CDATA[Element: Button]]></step>
	<step command="Comment"><![CDATA[Button with Text]]></step>
	<step command="Assert_Disabled"><![CDATA[ButtonWithText]]></step>
	<step command="Comment"><![CDATA[Button with Image alt]]></step>
	<step command="Assert_Disabled"><![CDATA[b_imageTestAlt]]></step>
	<step command="Comment"><![CDATA[Button with Image title]]></step>
	<step command="Assert_Disabled"><![CDATA[b_imageTestTitle]]></step>
	<step command="Comment"><![CDATA[Button with Image src]]></step>
	<step command="Assert_Disabled"><![CDATA[sword2.png]]></step>
	<step command="Comment"></step>
	<step command="Comment"></step>
	<step command="Comment"><![CDATA[Element: Input]]></step>
	<step command="Comment"><![CDATA[InputType Submit with Value]]></step>
	<step command="Assert_Disabled"><![CDATA[InputTypeSubmit]]></step>
	<step command="Comment"><![CDATA[InputType Button with Value]]></step>
	<step command="Assert_Disabled"><![CDATA[Button]]></step>
	<step command="Comment"><![CDATA[InputType Image with Alt]]></step>
	<step command="Assert_Disabled"><![CDATA[ImageButton]]></step>
	<step command="Comment"><![CDATA[InputType Image with Title]]></step>
	<step command="Assert_Disabled"><![CDATA[ImageButtonTitle]]></step>
	<step command="Comment"><![CDATA[InputType Image with src]]></step>
	<step command="Assert_Disabled"><![CDATA[sword1.png]]></step>
	<step command="Comment"><![CDATA[InputType Radio with id]]></step>
	<step command="Assert_Disabled"><![CDATA[i_r_inputtyperadioid]]></step>
	<step command="Comment"><![CDATA[InputType Radio with name makes no sense]]></step>
	<step command="Comment"><![CDATA[InputType Checkbox with id]]></step>
	<step command="Assert_Disabled"><![CDATA[i_c_inputtypecheckboxid]]></step>
	<step command="Comment"><![CDATA[InputType Checkbox with name]]></step>
	<step command="Assert_Disabled"><![CDATA[i_c_inputtypecheckboxname]]></step>
	<step command="Comment"></step>
	<step command="Comment"></step>
	<step command="Comment"><![CDATA[Element: Select]]></step>
	<step command="Comment"><![CDATA[SingleSelect with name]]></step>
	<step command="Assert_Disabled"><![CDATA[singleSelect_Name]]></step>
	<step command="Comment"><![CDATA[SingleSelect (incl. OptGroup) with name]]></step>
	<step command="Assert_Disabled"><![CDATA[singleSelectOptGroup_Name]]></step>
	<step command="Comment"><![CDATA[SingleSelect with id]]></step>
	<step command="Assert_Disabled"><![CDATA[singleSelect_Id]]></step>
	<step command="Comment"></step>
	<step command="Comment"></step>
	<step command="Comment"><![CDATA[Element: OptGroup]]></step>
	<step command="Comment"><![CDATA[Fails in IE 6.0 (Bug)]]></step>
	<step command="Comment"><![CDATA[OptGroup with Label]]></step>
	<step command="Assert_Disabled"><![CDATA[colors]]></step>
	<step command="Comment"><![CDATA[OptGroup with id]]></step>
	<step command="Assert_Disabled"><![CDATA[optgroup_colors]]></step>
	<step command="Comment"></step>
	<step command="Comment"></step>
	<step command="Comment"><![CDATA[Element: Option]]></step>
	<step command="Comment"><![CDATA[Fails in IE 6.0 (Bug)]]></step>
	<step command="Comment"><![CDATA[Option with id]]></step>
	<step command="Assert_Disabled"><![CDATA[option1]]></step>
	<step command="Comment"><![CDATA[Option (in OptGroup)  with id]]></step>
	<step command="Assert_Disabled"><![CDATA[option_red]]></step>
	<step command="Comment"><![CDATA[test for unused parameter]]></step>
	<step command="Assert_Fail"><![CDATA[Assert Disabled, The command 'Assert Disabled' does not use the value 'unused' provided in column 2.]]><optionalParameter><![CDATA[inputText_Name]]></optionalParameter>
	</step>
</testcase>