<?xml version="1.0" encoding="UTF-8"?><!DOCTYPE testcase SYSTEM "dtd/testcase.dtd">
<testcase>
	<step command="Open_Url"><![CDATA[testcases.html]]></step>
	<step command="Use_Module"><![CDATA[modules/module.xml]]></step>
	<step command="Comment"><![CDATA[after use module]]></step>
	<step command="Comment"></step>
	<step command="Comment"><![CDATA[module with parameter]]></step>
	<step command="Use_Module"><![CDATA[modules/module_with_parameters.xml]]><optionalParameter><![CDATA[assert_content.html, Wetator / Assert Content]]></optionalParameter>
	</step>
</testcase>