<?xml version="1.0" encoding="UTF-8"?><!DOCTYPE testcase SYSTEM "dtd/testcase.dtd">
<testcase>
	<step command="Open_Url"><![CDATA[anchor_inside_page.html#chapter1]]></step>
	<step command="Assert_Title"><![CDATA[Wetator / Anchor Inside Page]]></step>
	<step command="Comment"><![CDATA[unknown anchor]]></step>
	<step command="Assert_Fail"><![CDATA[Open Url, No id/anchor found for ref 'unknownAnchor'.]]><optionalParameter><![CDATA[anchor_inside_page.html#unknownAnchor]]></optionalParameter></step>
	<step command="Comment"><![CDATA[duplicate anchor]]></step>
	<step command="Open_Url"><![CDATA[anchor_inside_page.html#duplicteAnchor]]></step>
	<step command="Comment"><![CDATA[click on anchor]]></step>
	<step command="Open_Url"><![CDATA[anchor_inside_page.html]]></step>
	<step command="Click_On"><![CDATA[jump to 'Chapter 1']]></step>
	<step command="Assert_Fail"><![CDATA[Click On, No id/anchor found for ref 'chapter3'.]]><optionalParameter><![CDATA[jump to non existing anchor]]></optionalParameter></step>
	<step command="Click_On"><![CDATA[jump to duplicate anchor]]></step>
	<step command="Comment"><![CDATA[now the javascript game]]></step>
	<step command="Click_On"><![CDATA[open popup and jump to 'Chapter 1']]></step>
	<step command="Close_Window"></step>
	<step command="Assert_Fail"><![CDATA[Click On, No id/anchor found for ref 'chapter3'.]]><optionalParameter><![CDATA[open popup and jump to non existing anchor]]></optionalParameter></step>
	<step command="Close_Window"></step>
	<step command="Click_On"><![CDATA[open popup and jump to duplicate anchor]]></step>
	<step command="Close_Window"></step>
</testcase>