<?xml version="1.0" encoding="UTF-8"?><!DOCTYPE testcase SYSTEM "dtd/testcase.dtd">
<testcase>
	<step command="Open_Url"><![CDATA[set_upload.html]]></step>
	<step command="Assert_Title"><![CDATA[Wetator / Set Upload]]></step>
	<step command="Comment"><![CDATA[FileInput with name]]></step>
	<step command="Set"><![CDATA[inputFile_Name]]><optionalParameter><![CDATA[misc_files/test_file.txt]]></optionalParameter></step>
	<step command="Click_On"><![CDATA[InputFileNameTest]]></step>
	<step command="Assert_Content"><![CDATA[GET Parameters, Key, Value, InputFileNameTest, OK]]></step>
	<step command="Assert_Content"><![CDATA[File Upload, Upload Control, Values, inputFile_Name, name, test_file.txt, SampleData Content from ....]]></step>
	<step command="Comment"></step>
	<step command="Comment"></step>
	<step command="Open_Url"><![CDATA[set_upload.html]]></step>
	<step command="Assert_Title"><![CDATA[Wetator / Set Upload]]></step>
	<step command="Comment"><![CDATA[FileInput with id]]></step>
	<step command="Set"><![CDATA[inputFile_Id]]><optionalParameter><![CDATA[misc_files/test_file.txt]]></optionalParameter></step>
	<step command="Click_On"><![CDATA[InputFileIdTest]]></step>
	<step command="Assert_Content"><![CDATA[GET Parameters, Key, Value, InputFileIdTest, OK]]></step>
	<step command="Assert_Content"><![CDATA[File Upload, Upload Control, Values, inputFileId_Name, name, test_file.txt, SampleData Content from ....]]></step>
	<step command="Comment"></step>
	<step command="Comment"></step>
	<step command="Open_Url"><![CDATA[set_upload.html]]></step>
	<step command="Assert_Title"><![CDATA[Wetator / Set Upload]]></step>
	<step command="Comment"><![CDATA[FileInput with name and default]]></step>
	<step command="Set"><![CDATA[inputFile_Name_Value]]><optionalParameter><![CDATA[misc_files/test_file.txt]]></optionalParameter></step>
	<step command="Click_On"><![CDATA[InputFileNameValueTest]]></step>
	<step command="Assert_Content"><![CDATA[GET Parameters, Key, Value, InputFileNameValueTest, OK]]></step>
	<step command="Assert_Content"><![CDATA[File Upload, Upload Control, Values, inputFile_Name_Value, name, test_file.txt, SampleData Content from ....]]></step>
	<step command="Comment"></step>
	<step command="Comment"></step>
	<step command="Open_Url"><![CDATA[set_upload.html]]></step>
	<step command="Assert_Title"><![CDATA[Wetator / Set Upload]]></step>
	<step command="Comment"><![CDATA[FileInput with name and default; try to cleanup]]></step>
	<step command="Set"><![CDATA[inputFile_Name_Value]]></step>
	<step command="Click_On"><![CDATA[InputFileNameValueTest]]></step>
	<step command="Assert_Content"><![CDATA[GET Parameters, Key, Value, InputFileNameValueTest, OK]]></step>
	<step command="Assert_Content"><![CDATA[File Upload, Upload Control, Values, inputFile_Name_Value, name, size, 0]]></step>
	<step command="Comment"></step>
	<step command="Comment"></step>
	<step command="Open_Url"><![CDATA[set_upload.html]]></step>
	<step command="Assert_Title"><![CDATA[Wetator / Set Upload]]></step>
	<step command="Comment"><![CDATA[FileInput identified by label]]></step>
	<step command="Set"><![CDATA[InputFile Label]]><optionalParameter><![CDATA[misc_files/test_file.txt]]></optionalParameter></step>
	<step command="Click_On"><![CDATA[InputFileLabelTest]]></step>
	<step command="Assert_Content"><![CDATA[GET Parameters, Key, Value, InputFileLabelTest, OK]]></step>
	<step command="Assert_Content"><![CDATA[File Upload, Upload Control, Values, inputFile_Label, name, test_file.txt, SampleData Content from ....]]></step>
	<step command="Comment"></step>
	<step command="Comment"></step>
	<step command="Open_Url"><![CDATA[set_upload.html]]></step>
	<step command="Assert_Title"><![CDATA[Wetator / Set Upload]]></step>
	<step command="Comment"><![CDATA[FileInput identified by layout directly before]]></step>
	<step command="Set"><![CDATA[InputFile LayoutLabel before]]><optionalParameter><![CDATA[misc_files/test_file.txt]]></optionalParameter></step>
	<step command="Click_On"><![CDATA[InputFileLayoutBeforeTest]]></step>
	<step command="Assert_Content"><![CDATA[GET Parameters, Key, Value, InputFileLayoutBeforeTest, OK]]></step>
	<step command="Assert_Content"><![CDATA[File Upload, Upload Control, Values, inputFile_LayoutBefore, name, test_file.txt, SampleData Content from ....]]></step>
	<step command="Comment"></step>
	<step command="Comment"></step>
	<step command="Open_Url"><![CDATA[set_upload.html]]></step>
	<step command="Assert_Title"><![CDATA[Wetator / Set Upload]]></step>
	<step command="Comment"><![CDATA[FileInput identified by layout directly before formated]]></step>
	<step command="Set"><![CDATA[InputFile LayoutLabel before formated]]><optionalParameter><![CDATA[misc_files/test_file.txt]]></optionalParameter></step>
	<step command="Click_On"><![CDATA[InputFileLayoutBeforeFormatedTest]]></step>
	<step command="Assert_Content"><![CDATA[GET Parameters, Key, Value, InputFileLayoutBeforeFormatedTest, OK]]></step>
	<step command="Assert_Content"><![CDATA[File Upload, Upload Control, Values, inputFile_LayoutBeforeFormated, name, test_file.txt, SampleData Content from ....]]></step>
	<step command="Comment"></step>
	<step command="Comment"></step>
	<step command="Open_Url"><![CDATA[set_upload.html]]></step>
	<step command="Assert_Title"><![CDATA[Wetator / Set Upload]]></step>
	<step command="Comment"><![CDATA[FileInput identified by layout at top]]></step>
	<step command="Set"><![CDATA[InputFile LayoutLabel at top]]><optionalParameter><![CDATA[misc_files/test_file.txt]]></optionalParameter></step>
	<step command="Click_On"><![CDATA[InputFileLayoutTopTest]]></step>
	<step command="Assert_Content"><![CDATA[GET Parameters, Key, Value, InputFileLayoutTopTest, OK]]></step>
	<step command="Assert_Content"><![CDATA[File Upload, Upload Control, Values, inputFile_LayoutTop, name, test_file.txt, SampleData Content from ....]]></step>
	<step command="Comment"></step>
	<step command="Comment"></step>
	<step command="Open_Url"><![CDATA[set_upload.html]]></step>
	<step command="Assert_Title"><![CDATA[Wetator / Set Upload]]></step>
	<step command="Comment"><![CDATA[FileInput identified by layout at top formated]]></step>
	<step command="Set"><![CDATA[InputFile LayoutLabel at top formated]]><optionalParameter><![CDATA[misc_files/test_file.txt]]></optionalParameter></step>
	<step command="Click_On"><![CDATA[InputFileLayoutTopFormatedTest]]></step>
	<step command="Assert_Content"><![CDATA[GET Parameters, Key, Value, InputFileLayoutTopFormatedTest, OK]]></step>
	<step command="Assert_Content"><![CDATA[File Upload, Upload Control, Values, inputFile_LayoutTopFormated, name, test_file.txt, SampleData Content from ....]]></step>
	<step command="Comment"></step>
	<step command="Comment"></step>
	<step command="Open_Url"><![CDATA[set_upload.html]]></step>
	<step command="Assert_Title"><![CDATA[Wetator / Set Upload]]></step>
	<step command="Comment"><![CDATA[FileInput identified by layout at left]]></step>
	<step command="Set"><![CDATA[InputFile LayoutLabel at left]]><optionalParameter><![CDATA[misc_files/test_file.txt]]></optionalParameter></step>
	<step command="Click_On"><![CDATA[InputFileLayoutLeftTest]]></step>
	<step command="Assert_Content"><![CDATA[GET Parameters, Key, Value, InputFileLayoutLeftTest, OK]]></step>
	<step command="Assert_Content"><![CDATA[File Upload, Upload Control, Values, inputFile_LayoutLeft, name, test_file.txt, SampleData Content from ....]]></step>
	<step command="Comment"></step>
	<step command="Comment"></step>
	<step command="Open_Url"><![CDATA[set_upload.html]]></step>
	<step command="Assert_Title"><![CDATA[Wetator / Set Upload]]></step>
	<step command="Comment"><![CDATA[FileInput identified by layout at left formated]]></step>
	<step command="Set"><![CDATA[InputFile LayoutLabel at left formated]]><optionalParameter><![CDATA[misc_files/test_file.txt]]></optionalParameter></step>
	<step command="Click_On"><![CDATA[InputFileLayoutLeftFormatedTest]]></step>
	<step command="Assert_Content"><![CDATA[GET Parameters, Key, Value, InputFileLayoutLeftFormatedTest, OK]]></step>
	<step command="Assert_Content"><![CDATA[File Upload, Upload Control, Values, inputFile_LayoutLeftFormated, name, test_file.txt, SampleData Content from ....]]></step>
	<step command="Comment"></step>
	<step command="Comment"></step>
</testcase>