<?xml version="1.0" encoding="UTF-8"?><!DOCTYPE testcase SYSTEM "dtd/testcase.dtd">
<testcase>
	<step command="Open_Url"><![CDATA[select_after.html]]></step>
	<step command="Assert_Title"><![CDATA[Wetator / Select After]]></step>
	<step command="Comment"><![CDATA[CheckBox with name]]></step>
	<step command="Select"><![CDATA[Select after this text, checkBox_after_Name]]></step>
	<step command="Click_On"><![CDATA[CheckBoxNameAfterTest]]></step>
	<step command="Assert_Content"><![CDATA[GET Parameters, Key, Value, checkBox_after_Name, check_Name, CheckBoxNameAfterTest, OK]]></step>
	<step command="Comment"></step>
	<step command="Comment"></step>
	<step command="Open_Url"><![CDATA[select_after.html]]></step>
	<step command="Assert_Title"><![CDATA[Wetator / Select After]]></step>
	<step command="Comment"><![CDATA[CheckBox with id]]></step>
	<step command="Select"><![CDATA[Select after this text, checkBox_after_Id]]></step>
	<step command="Click_On"><![CDATA[CheckBoxIdAfterTest]]></step>
	<step command="Assert_Content"><![CDATA[GET Parameters, Key, Value, checkBoxId_after_Name, check_Id, CheckBoxIdAfterTest, OK]]></step>
	<step command="Comment"></step>
	<step command="Comment"></step>
	<step command="Open_Url"><![CDATA[select_after.html]]></step>
	<step command="Assert_Title"><![CDATA[Wetator / Select After]]></step>
	<step command="Comment"><![CDATA[CheckBox with default selection]]></step>
	<step command="Select"><![CDATA[Select after this text, checkBox_after_NameChecked]]></step>
	<step command="Click_On"><![CDATA[CheckBoxNameValueAfterTest]]></step>
	<step command="Assert_Content"><![CDATA[GET Parameters, Key, Value, checkBox_after_NameChecked, check_Checked, CheckBoxNameValueAfterTest, OK]]></step>
	<step command="Comment"></step>
	<step command="Comment"></step>
	<step command="Open_Url"><![CDATA[select_after.html]]></step>
	<step command="Assert_Title"><![CDATA[Wetator / Select After]]></step>
	<step command="Comment"><![CDATA[CheckBox identified by label]]></step>
	<step command="Select"><![CDATA[Select after this text, CheckBox Label]]></step>
	<step command="Click_On"><![CDATA[CheckBoxLabelAfterTest]]></step>
	<step command="Assert_Content"><![CDATA[GET Parameters, Key, Value, checkBox_after_Label, check_Label, CheckBoxLabelAfterTest, OK]]></step>
	<step command="Comment"></step>
	<step command="Comment"></step>
	<step command="Open_Url"><![CDATA[select_after.html]]></step>
	<step command="Assert_Title"><![CDATA[Wetator / Select After]]></step>
	<step command="Comment"><![CDATA[CheckBox identified by layout directly after]]></step>
	<step command="Select"><![CDATA[Select after this text, CheckBox LayoutLabel after]]></step>
	<step command="Click_On"><![CDATA[CheckBoxLayoutAfterAfterTest]]></step>
	<step command="Assert_Content"><![CDATA[GET Parameters, Key, Value, checkBox_after_LayoutAfter, check_LayoutAfter, CheckBoxLayoutAfterAfterTest, OK]]></step>
	<step command="Comment"></step>
	<step command="Comment"></step>
	<step command="Open_Url"><![CDATA[select_after.html]]></step>
	<step command="Assert_Title"><![CDATA[Wetator / Select After]]></step>
	<step command="Comment"><![CDATA[CheckBox identified by layout directly after formated]]></step>
	<step command="Select"><![CDATA[Select after this text, CheckBox LayoutLabel after formated]]></step>
	<step command="Click_On"><![CDATA[CheckBoxLayoutAfterFormatedAfterTest]]></step>
	<step command="Assert_Content"><![CDATA[GET Parameters, Key, Value, checkBox_after_LayoutAfterFormated, check_LayoutAfterFormated, CheckBoxLayoutAfterFormatedAfterTest, OK]]></step>
	<step command="Comment"></step>
	<step command="Comment"></step>
	<step command="Open_Url"><![CDATA[select_after.html]]></step>
	<step command="Assert_Title"><![CDATA[Wetator / Select After]]></step>
	<step command="Comment"><![CDATA[CheckBox identified by layout at bottom]]></step>
	<step command="Select"><![CDATA[Select after this text, CheckBox LayoutLabel at bottom]]></step>
	<step command="Click_On"><![CDATA[CheckBoxLayoutBottomAfterTest]]></step>
	<step command="Assert_Content"><![CDATA[GET Parameters, Key, Value, checkBox_after_LayoutBottom, check_LayoutBottom, CheckBoxLayoutBottomAfterTest, OK]]></step>
	<step command="Comment"></step>
	<step command="Comment"></step>
	<step command="Open_Url"><![CDATA[select_after.html]]></step>
	<step command="Assert_Title"><![CDATA[Wetator / Select After]]></step>
	<step command="Comment"><![CDATA[CheckBox identified by layout at bottom formated]]></step>
	<step command="Select"><![CDATA[Select after this text, CheckBox LayoutLabel at bottom formated]]></step>
	<step command="Click_On"><![CDATA[CheckBoxLayoutBottomFormatedAfterTest]]></step>
	<step command="Assert_Content"><![CDATA[GET Parameters, Key, Value, checkBox_after_LayoutBottomFormated, check_LayoutBottomFormated, CheckBoxLayoutBottomFormatedAfterTest, OK]]></step>
	<step command="Comment"></step>
	<step command="Comment"></step>
	<step command="Open_Url"><![CDATA[select_after.html]]></step>
	<step command="Assert_Title"><![CDATA[Wetator / Select After]]></step>
	<step command="Comment"><![CDATA[CheckBox identified by layout at right]]></step>
	<step command="Select"><![CDATA[Select after this text, CheckBox LayoutLabel at right]]></step>
	<step command="Click_On"><![CDATA[CheckBoxLayoutRightAfterTest]]></step>
	<step command="Assert_Content"><![CDATA[GET Parameters, Key, Value, checkBox_after_LayoutRight, check_LayoutRight, CheckBoxLayoutRightAfterTest, OK]]></step>
	<step command="Comment"></step>
	<step command="Comment"></step>
	<step command="Open_Url"><![CDATA[select_after.html]]></step>
	<step command="Assert_Title"><![CDATA[Wetator / Select After]]></step>
	<step command="Comment"><![CDATA[CheckBox identified by layout at right formated]]></step>
	<step command="Select"><![CDATA[Select after this text, CheckBox LayoutLabel at right formated]]></step>
	<step command="Click_On"><![CDATA[CheckBoxLayoutRightFormatedAfterTest]]></step>
	<step command="Assert_Content"><![CDATA[GET Parameters, Key, Value, checkBox_after_LayoutRightFormated, check_LayoutRightFormated, CheckBoxLayoutRightFormatedAfterTest, OK]]></step>
	<step command="Comment"></step>
	<step command="Comment"></step>
	<step command="Comment"></step>
	<step command="Comment"></step>
</testcase>